{
  "catalog_version": 10,
  "generated_at": "2026-08-11T00:00:00Z",
  "decks": [
    {
      "deck_id": "official_keyboard_start",
      "version": 4,
      "name": "はじめての2ボル式",
      "author_nickname": "ピヨキー 公式",
      "official": true,
      "featured": true,
      "type": "word",
      "level": 1,
      "tags": [
        "入門",
        "キーボード",
        "公式"
      ],
      "localizations": {
        "en": {
          "name": "First Steps with Dubeolsik",
          "author_nickname": "typee Official",
          "tags": [
            "Beginner Basics",
            "Keyboard",
            "Official"
          ]
        },
        "ko": {
          "name": "두벌식 첫걸음",
          "author_nickname": "피요키 공식",
          "tags": [
            "입문",
            "키보드",
            "공식"
          ]
        }
      },
      "item_count": 12,
      "size_bytes": 4209,
      "downloads_total": 0,
      "downloads_7d": 0,
      "created_at": "2026-01-06T00:00:00Z",
      "preview_items": [
        {
          "ko": "라",
          "meaning_ja": "ㄹ + ㅏ",
          "localizations": {
            "en": {
              "meaning": "ㄹ + ㅏ"
            }
          }
        },
        {
          "ko": "마",
          "meaning_ja": "ㅁ + ㅏ",
          "localizations": {
            "en": {
              "meaning": "ㅁ + ㅏ"
            }
          }
        },
        {
          "ko": "보",
          "meaning_ja": "ㅂ + ㅗ",
          "localizations": {
            "en": {
              "meaning": "ㅂ + ㅗ"
            }
          }
        },
        {
          "ko": "소",
          "meaning_ja": "ㅅ + ㅗ",
          "localizations": {
            "en": {
              "meaning": "ㅅ + ㅗ"
            }
          }
        },
        {
          "ko": "우",
          "meaning_ja": "ㅇ + ㅜ",
          "localizations": {
            "en": {
              "meaning": "ㅇ + ㅜ"
            }
          }
        },
        {
          "ko": "지",
          "meaning_ja": "ㅈ + ㅣ",
          "localizations": {
            "en": {
              "meaning": "ㅈ + ㅣ"
            }
          }
        },
        {
          "ko": "해",
          "meaning_ja": "ㅎ + ㅐ",
          "localizations": {
            "en": {
              "meaning": "ㅎ + ㅐ"
            }
          }
        },
        {
          "ko": "가",
          "meaning_ja": "ㄱ + ㅏ",
          "localizations": {
            "en": {
              "meaning": "ㄱ + ㅏ"
            }
          }
        },
        {
          "ko": "나",
          "meaning_ja": "ㄴ + ㅏ",
          "localizations": {
            "en": {
              "meaning": "ㄴ + ㅏ"
            }
          }
        },
        {
          "ko": "다",
          "meaning_ja": "ㄷ + ㅏ",
          "localizations": {
            "en": {
              "meaning": "ㄷ + ㅏ"
            }
          }
        }
      ],
      "file_url": "decks/official_keyboard_start_v4.json"
    },
    {
      "deck_id": "official_consonants",
      "version": 4,
      "name": "基本子音を覚えよう",
      "author_nickname": "ピヨキー 公式",
      "official": true,
      "featured": false,
      "type": "word",
      "level": 1,
      "tags": [
        "入門",
        "子音",
        "公式"
      ],
      "localizations": {
        "en": {
          "name": "Basic Korean Consonants",
          "author_nickname": "typee Official",
          "tags": [
            "Beginner Basics",
            "Consonants",
            "Official"
          ]
        },
        "ko": {
          "name": "기본 자음 익히기",
          "author_nickname": "피요키 공식",
          "tags": [
            "입문",
            "자음",
            "공식"
          ]
        }
      },
      "item_count": 12,
      "size_bytes": 4467,
      "downloads_total": 0,
      "downloads_7d": 0,
      "created_at": "2026-01-11T00:00:00Z",
      "preview_items": [
        {
          "ko": "ㅅ",
          "meaning_ja": "基本子音 ㅅ",
          "localizations": {
            "en": {
              "meaning": "basic consonant ㅅ"
            }
          }
        },
        {
          "ko": "ㅇ",
          "meaning_ja": "基本子音 ㅇ",
          "localizations": {
            "en": {
              "meaning": "basic consonant ㅇ"
            }
          }
        },
        {
          "ko": "ㅈ",
          "meaning_ja": "基本子音 ㅈ",
          "localizations": {
            "en": {
              "meaning": "basic consonant ㅈ"
            }
          }
        },
        {
          "ko": "ㅎ",
          "meaning_ja": "基本子音 ㅎ",
          "localizations": {
            "en": {
              "meaning": "basic consonant ㅎ"
            }
          }
        },
        {
          "ko": "ㄱ",
          "meaning_ja": "基本子音 ㄱ",
          "localizations": {
            "en": {
              "meaning": "basic consonant ㄱ"
            }
          }
        },
        {
          "ko": "ㄴ",
          "meaning_ja": "基本子音 ㄴ",
          "localizations": {
            "en": {
              "meaning": "basic consonant ㄴ"
            }
          }
        },
        {
          "ko": "ㄷ",
          "meaning_ja": "基本子音 ㄷ",
          "localizations": {
            "en": {
              "meaning": "basic consonant ㄷ"
            }
          }
        },
        {
          "ko": "ㄹ",
          "meaning_ja": "基本子音 ㄹ",
          "localizations": {
            "en": {
              "meaning": "basic consonant ㄹ"
            }
          }
        },
        {
          "ko": "ㅁ",
          "meaning_ja": "基本子音 ㅁ",
          "localizations": {
            "en": {
              "meaning": "basic consonant ㅁ"
            }
          }
        },
        {
          "ko": "ㅂ",
          "meaning_ja": "基本子音 ㅂ",
          "localizations": {
            "en": {
              "meaning": "basic consonant ㅂ"
            }
          }
        }
      ],
      "file_url": "decks/official_consonants_v4.json"
    },
    {
      "deck_id": "official_vowels",
      "version": 4,
      "name": "基本母音を覚えよう",
      "author_nickname": "ピヨキー 公式",
      "official": true,
      "featured": false,
      "type": "word",
      "level": 1,
      "tags": [
        "入門",
        "母音",
        "公式"
      ],
      "localizations": {
        "en": {
          "name": "Basic Korean Vowels",
          "author_nickname": "typee Official",
          "tags": [
            "Beginner Basics",
            "Vowels",
            "Official"
          ]
        },
        "ko": {
          "name": "기본 모음 익히기",
          "author_nickname": "피요키 공식",
          "tags": [
            "입문",
            "모음",
            "공식"
          ]
        }
      },
      "item_count": 12,
      "size_bytes": 4338,
      "downloads_total": 0,
      "downloads_7d": 0,
      "created_at": "2026-01-16T00:00:00Z",
      "preview_items": [
        {
          "ko": "ㅕ",
          "meaning_ja": "基本母音 ㅕ",
          "localizations": {
            "en": {
              "meaning": "basic vowel ㅕ"
            }
          }
        },
        {
          "ko": "ㅏ",
          "meaning_ja": "基本母音 ㅏ",
          "localizations": {
            "en": {
              "meaning": "basic vowel ㅏ"
            }
          }
        },
        {
          "ko": "ㅓ",
          "meaning_ja": "基本母音 ㅓ",
          "localizations": {
            "en": {
              "meaning": "basic vowel ㅓ"
            }
          }
        },
        {
          "ko": "ㅗ",
          "meaning_ja": "基本母音 ㅗ",
          "localizations": {
            "en": {
              "meaning": "basic vowel ㅗ"
            }
          }
        },
        {
          "ko": "ㅜ",
          "meaning_ja": "基本母音 ㅜ",
          "localizations": {
            "en": {
              "meaning": "basic vowel ㅜ"
            }
          }
        },
        {
          "ko": "ㅡ",
          "meaning_ja": "基本母音 ㅡ",
          "localizations": {
            "en": {
              "meaning": "basic vowel ㅡ"
            }
          }
        },
        {
          "ko": "ㅣ",
          "meaning_ja": "基本母音 ㅣ",
          "localizations": {
            "en": {
              "meaning": "basic vowel ㅣ"
            }
          }
        },
        {
          "ko": "ㅐ",
          "meaning_ja": "基本母音 ㅐ",
          "localizations": {
            "en": {
              "meaning": "basic vowel ㅐ"
            }
          }
        },
        {
          "ko": "ㅔ",
          "meaning_ja": "基本母音 ㅔ",
          "localizations": {
            "en": {
              "meaning": "basic vowel ㅔ"
            }
          }
        },
        {
          "ko": "ㅑ",
          "meaning_ja": "基本母音 ㅑ",
          "localizations": {
            "en": {
              "meaning": "basic vowel ㅑ"
            }
          }
        }
      ],
      "file_url": "decks/official_vowels_v4.json"
    },
    {
      "deck_id": "official_syllable_building",
      "version": 4,
      "name": "子音＋母音で組み立てる",
      "author_nickname": "ピヨキー 公式",
      "official": true,
      "featured": false,
      "type": "word",
      "level": 1,
      "tags": [
        "入門",
        "組み立て",
        "公式"
      ],
      "localizations": {
        "en": {
          "name": "Build Korean Syllables",
          "author_nickname": "typee Official",
          "tags": [
            "Beginner Basics",
            "Syllable Building",
            "Official"
          ]
        },
        "ko": {
          "name": "자음과 모음으로 음절 만들기",
          "author_nickname": "피요키 공식",
          "tags": [
            "입문",
            "음절 조합",
            "공식"
          ]
        }
      },
      "item_count": 12,
      "size_bytes": 4246,
      "downloads_total": 0,
      "downloads_7d": 0,
      "created_at": "2026-01-21T00:00:00Z",
      "preview_items": [
        {
          "ko": "다",
          "meaning_ja": "ㄷ + ㅏ",
          "localizations": {
            "en": {
              "meaning": "ㄷ + ㅏ"
            }
          }
        },
        {
          "ko": "라",
          "meaning_ja": "ㄹ + ㅏ",
          "localizations": {
            "en": {
              "meaning": "ㄹ + ㅏ"
            }
          }
        },